<?xml version="1.0" encoding="UTF-8"?>
<hospital nombre="Hospital Central"
    xmlns:xsi="http://www.w3.org/2001/XMLSchema-instance"
    xsi:noNamespaceSchemaLocation="hospital.xsd">
    <profesionales>
        <auxiliares>
            <auxiliar id="A1">
                <nombre>Juan</nombre>
                <apellidos>Pérez</apellidos>
                <seccion>Atención</seccion>
            </auxiliar>
            <auxiliar id="A2">
                <nombre>Carlos</nombre>
                <apellidos>Gómez</apellidos>
                <seccion>Emergencias</seccion>
            </auxiliar>
            <auxiliar id="A3">
                <nombre>Mario</nombre>
                <apellidos>Rodríguez</apellidos>
                <seccion>Pediatría</seccion>
            </auxiliar>
            <auxiliar id="A4">
                <nombre>Antonio</nombre>
                <apellidos>Fernández</apellidos>
                <seccion>Urgencias</seccion>
            </auxiliar>
        </auxiliares>
        <cirujanos>
            <cirujano id="C1">
                <nombre>Pedro</nombre>
                <apellidos>Ramírez</apellidos>
                <seccion>Cirugía General</seccion>
            </cirujano>
            <cirujano id="C2">
                <nombre>Roberto</nombre>
                <apellidos>Sánchez</apellidos>
                <seccion>Cardiovascular</seccion>
            </cirujano>
            <cirujano id="C3">
                <nombre>Diego</nombre>
                <apellidos>Martín</apellidos>
                <seccion>Neurocirugía</seccion>
            </cirujano>
            <cirujano id="C4">
                <nombre>Jorge</nombre>
                <apellidos>Vega</apellidos>
                <seccion>Ortopedia</seccion>
            </cirujano>
        </cirujanos>
        <enfermeros>
            <enfermero id="E1">
                <nombre>Ana</nombre>
                <apellidos>García</apellidos>
                <seccion>Cuidados Intensivos</seccion>
            </enfermero>
            <enfermero id="E2">
                <nombre>Lucía</nombre>
                <apellidos>Hernández</apellidos>
                <seccion>Rehabilitación</seccion>
            </enfermero>
            <enfermero id="E3">
                <nombre>Elena</nombre>
                <apellidos>López</apellidos>
                <seccion>Pediatría</seccion>
            </enfermero>
            <enfermero id="E4">
                <nombre>Sofía</nombre>
                <apellidos>Gómez</apellidos>
                <seccion>Quirófano</seccion>
            </enfermero>
        </enfermeros>
        <doctores>
            <doctor id="D1" licenciado="Si">
                <nombre>Laura</nombre>
                <apellidos>Martínez</apellidos>
                <seccion>Medicina Interna</seccion>
            </doctor>
            <doctor id="D2" licenciado="Si">
                <nombre>María</nombre>
                <apellidos>Ruiz</apellidos>
                <seccion>Oncología</seccion>
            </doctor>
            <doctor id="D3" licenciado="Si">
                <nombre>Carmen</nombre>
                <apellidos>Domínguez</apellidos>
                <seccion>Ginecología</seccion>
            </doctor>
            <doctor id="D4" licenciado="Si">
                <nombre>Isabel</nombre>
                <apellidos>Jiménez</apellidos>
                <seccion>Neurología</seccion>
            </doctor>
        </doctores>
    </profesionales>
    <pacientes>
        <paciente DNI="12345678A">
            <nombre>Raúl</nombre>
            <apellidos>Alonso</apellidos>
            <fichaMedica>Historial de hipertensión.</fichaMedica>
        </paciente>
        <paciente DNI="87654321B">
            <nombre>Silvia</nombre>
            <apellidos>Morales</apellidos>
            <fichaMedica>Antecedentes de diabetes.</fichaMedica>
        </paciente>
        <paciente DNI="11223344C">
            <nombre>Antonio</nombre>
            <apellidos>Vargas</apellidos>
            <fichaMedica>Control de asma leve.</fichaMedica>
        </paciente>
        <paciente DNI="44332211D">
            <nombre>Elena</nombre>
            <apellidos>Castro</apellidos>
            <fichaMedica>Recuperación de cirugía reciente.</fichaMedica>
        </paciente>
    </pacientes>
</hospital>